pclass,survived,Residence,name,age,sibsp,parch,ticket,fare,cabin,embarked,boat,body,home.dest,Gender
3,0,0,"Abbing, Mr. Anthony",42,0,0,C.A. 5547,7.55, ,S, , , ,0
3,0,0,"Abbott, Master. Eugene Joseph",13,0,2,C.A. 2673,20.25, ,S, , ,"East Providence, RI",0
3,0,0,"Abbott, Mr. Rossmore Edward",16,1,1,C.A. 2673,20.25, ,S, ,190,"East Providence, RI",0
3,1,0,"Abbott, Mrs. Stanton (Rosa Hunt)",35,1,1,C.A. 2673,20.25, ,S,A, ,"East Providence, RI",1
3,1,2,"Abelseth, Miss. Karen Marie",16,0,0,348125,7.65, ,S,16, ,"Norway Los Angeles, CA",1
3,1,0,"Abelseth, Mr. Olaus Jorgensen",25,0,0,348122,7.65,F G63,S,A, ,"Perkins County, SD",0
2,0,2,"Abelson, Mr. Samuel",30,1,0,P/PP 3381,24, ,C, , ,"Russia New York, NY",0
2,1,2,"Abelson, Mrs. Samuel (Hannah Wizosky)",28,1,0,P/PP 3381,24, ,C,10, ,"Russia New York, NY",1
3,1,2,"Abrahamsson, Mr. Abraham August Johannes",20,0,0,SOTON/O2 3101284,7.925, ,S,15, ,"Taalintehdas, Finland Hoboken, NJ",0
3,1,2,"Abrahim, Mrs. Joseph (Sophie Halaut Easu)",18,0,0,2657,7.2292, ,C,C, ,"Greensburg, PA",1
3,0,2,"Adahl, Mr. Mauritz Nils Martin",30,0,0,C 7076,7.25, ,S, ,72,"Asarum, Sweden Brooklyn, NY",0
3,0,1,"Adams, Mr. John",26,0,0,341826,8.05, ,S, ,103,"Bournemouth, England",0
3,0,2,"Ahlin, Mrs. Johan (Johanna Persdotter Larsson)",40,1,0,7546,9.475, ,S, , ,"Sweden Akeley, MN",1
3,1,1,"Aks, Master. Philip Frank",.8333,0,1,392091,9.35, ,S,11, ,"London, England Norfolk, VA",0
3,1,2,"Aks, Mrs. Sam (Leah Rosen)",18,0,1,392091,9.35, ,S,13, ,"London, England Norfolk, VA",1
3,1,2,"Albimona, Mr. Nassef Cassem",26,0,0,2699,18.7875, ,C,15, ,"Syria Fredericksburg, VA",0
2,0,0,"Aldworth, Mr. Charles Augustus",30,0,0,248744,13, ,S, , ,"Bryn Mawr, PA, USA",0
3,0,1,"Alexander, Mr. William",26,0,0,3474,7.8875, ,S, , ,"England Albion, NY",0
3,0,2,"Alhomaki, Mr. Ilmari Rudolf",20,0,0,SOTON/O2 3101287,7.925, ,S, , ,"Salo, Finland Astoria, OR",0
3,0,2,"Ali, Mr. Ahmed",24,0,0,SOTON/O.Q. 3101311,7.05, ,S, , , ,0
3,0,2,"Ali, Mr. William",25,0,0,SOTON/O.Q. 3101312,7.05, ,S, ,79,Argentina,0
1,1,0,"Allen, Miss. Elisabeth Walton",29,0,0,24160,211.3375,B5,S,2, ,"St Louis, MO",1
3,0,1,"Allen, Mr. William Henry",35,0,0,373450,8.05, ,S, , ,"Lower Clapton, Middlesex or Erdington, Birmingham",0
1,1,2,"Allison, Master. Hudson Trevor",.9167,1,2,113781,151.55,C22 C26,S,11, ,"Montreal, PQ / Chesterville, ON",0
1,0,2,"Allison, Miss. Helen Loraine",2,1,2,113781,151.55,C22 C26,S, , ,"Montreal, PQ / Chesterville, ON",1
1,0,2,"Allison, Mr. Hudson Joshua Creighton",30,1,2,113781,151.55,C22 C26,S, ,135,"Montreal, PQ / Chesterville, ON",0
1,0,2,"Allison, Mrs. Hudson J C (Bessie Waldo Daniels)",25,1,2,113781,151.55,C22 C26,S, , ,"Montreal, PQ / Chesterville, ON",1
3,0,1,"Allum, Mr. Owen George",18,0,0,2223,8.3, ,S, ,259,"Windsor, England New York, NY",0
3,1,2,"Andersen-Jensen, Miss. Carla Christine Nielsine",19,1,0,350046,7.8542, ,S,16, , ,1
3,0,2,"Andersen, Mr. Albert Karvin",32,0,0,C 4001,22.525, ,S, ,260,"Bergen, Norway",0
1,1,0,"Anderson, Mr. Harry",48,0,0,19952,26.55,E12,S,3, ,"New York, NY",0
3,0,2,"Andersson, Master. Sigvard Harald Elias",4,4,2,347082,31.275, ,S, , ,"Sweden Winnipeg, MN",0
3,0,2,"Andersson, Miss. Ebba Iris Alfrida",6,4,2,347082,31.275, ,S, , ,"Sweden Winnipeg, MN",1
3,0,2,"Andersson, Miss. Ellis Anna Maria",2,4,2,347082,31.275, ,S, , ,"Sweden Winnipeg, MN",1
3,1,2,"Andersson, Miss. Erna Alexandra",17,4,2,3101281,7.925, ,S,D, ,"Ruotsinphyhtaa, Finland New York, NY",1
3,0,2,"Andersson, Miss. Ida Augusta Margareta",38,4,2,347091,7.775, ,S, , ,"Vadsbro, Sweden Ministee, MI",1
3,0,2,"Andersson, Miss. Ingeborg Constanzia",9,4,2,347082,31.275, ,S, , ,"Sweden Winnipeg, MN",1
3,0,2,"Andersson, Miss. Sigrid Elisabeth",11,4,2,347082,31.275, ,S, , ,"Sweden Winnipeg, MN",1
3,0,2,"Andersson, Mr. Anders Johan",39,1,5,347082,31.275, ,S, , ,"Sweden Winnipeg, MN",0
3,1,2,"Andersson, Mr. August Edvard (""Wennerstrom"")",27,0,0,350043,7.7958, ,S,A, , ,0
3,0,2,"Andersson, Mr. Johan Samuel",26,0,0,347075,7.775, ,S, , ,"Hartford, CT",0
3,0,2,"Andersson, Mrs. Anders Johan (Alfrida Konstantia Brogren)",39,1,5,347082,31.275, ,S, , ,"Sweden Winnipeg, MN",1
3,0,2,"Andreasson, Mr. Paul Edvin",20,0,0,347466,7.8542, ,S, , ,"Sweden Chicago, IL",0
2,0,2,"Andrew, Mr. Edgardo Samuel",18,0,0,231945,11.5, ,S, , ,"Buenos Aires, Argentina / New Jersey, NJ",0
2,0,1,"Andrew, Mr. Frank Thomas",25,0,0,C.A. 34050,10.5, ,S, , ,"Cornwall, England Houghton, MI",0
1,1,0,"Andrews, Miss. Kornelia Theodosia",63,1,0,13502,77.9583,D7,S,10, ,"Hudson, NY",1
1,0,2,"Andrews, Mr. Thomas Jr",39,0,0,112050,0,A36,S, , ,"Belfast, NI",0
3,0,2,"Angheloff, Mr. Minko",26,0,0,349202,7.8958, ,S, , ,"Bulgaria Chicago, IL",0
2,0,1,"Angle, Mr. William A",34,1,0,226875,26, ,S, , ,"Warwick, England",0
2,1,1,"Angle, Mrs. William A (Florence ""Mary"" Agnes Hughes)",36,1,0,226875,26, ,S,11, ,"Warwick, England",1
1,1,2,"Appleton, Mrs. Edward Dale (Charlotte Lamson)",53,2,0,11769,51.4792,C101,S,D, ,"Bayside, Queens, NY",1
3,0,2,"Arnold-Franchi, Mr. Josef",25,1,0,349237,17.8, ,S, , ,"Altdorf, Switzerland",0
3,0,2,"Arnold-Franchi, Mrs. Josef (Josefine Franchi)",18,1,0,349237,17.8, ,S, , ,"Altdorf, Switzerland",1
3,0,2,"Aronsson, Mr. Ernst Axel Algot",24,0,0,349911,7.775, ,S, , ,"Sweden Joliet, IL",0
1,0,2,"Artagaveytia, Mr. Ramon",71,0,0,PC 17609,49.5042, ,C, ,22,"Montevideo, Uruguay",0
2,0,0,"Ashby, Mr. John",57,0,0,244346,13, ,S, , ,"West Hoboken, NJ",0
3,0,2,"Asim, Mr. Adola",35,0,0,SOTON/O.Q. 3101310,7.05, ,S, , , ,0
3,0,2,"Asplund, Master. Carl Edgar",5,4,2,347077,31.3875, ,S, , ,"Sweden  Worcester, MA",0
3,0,2,"Asplund, Master. Clarence Gustaf Hugo",9,4,2,347077,31.3875, ,S, , ,"Sweden Worcester, MA",0
3,1,2,"Asplund, Master. Edvin Rojj Felix",3,4,2,347077,31.3875, ,S,15, ,"Sweden Worcester, MA",0
3,0,2,"Asplund, Master. Filip Oscar",13,4,2,347077,31.3875, ,S, , ,"Sweden Worcester, MA",0
3,1,2,"Asplund, Miss. Lillian Gertrud",5,4,2,347077,31.3875, ,S,15, ,"Sweden Worcester, MA",1
3,0,2,"Asplund, Mr. Carl Oscar Vilhelm Gustafsson",40,1,5,347077,31.3875, ,S, ,142,"Sweden  Worcester, MA",0
3,1,2,"Asplund, Mr. Johan Charles",23,0,0,350054,7.7958, ,S,13, ,"Oskarshamn, Sweden Minneapolis, MN",0
3,1,2,"Asplund, Mrs. Carl Oscar (Selma Augusta Emilia Johansson)",38,1,5,347077,31.3875, ,S,15, ,"Sweden  Worcester, MA",1
3,1,2,"Assaf Khalil, Mrs. Mariana (""Miriam"")",45,0,0,2696,7.225, ,C,C, ,"Ottawa, ON",1
3,0,2,"Assaf, Mr. Gerios",21,0,0,2692,7.225, ,C, , ,"Ottawa, ON",0
3,0,2,"Assam, Mr. Ali",23,0,0,SOTON/O.Q. 3101309,7.05, ,S, , , ,0
1,0,0,"Astor, Col. John Jacob",47,1,0,PC 17757,227.525,C62 C64,C, ,124,"New York, NY",0
1,1,0,"Astor, Mrs. John Jacob (Madeleine Talmadge Force)",18,1,0,PC 17757,227.525,C62 C64,C,4, ,"New York, NY",1
3,0,2,"Attalah, Miss. Malake",17,0,0,2627,14.4583, ,C, , , ,1
3,0,2,"Attalah, Mr. Sleiman",30,0,0,2694,7.225, ,C, , ,"Ottawa, ON",0
1,1,2,"Aubart, Mme. Leontine Pauline",24,0,0,PC 17477,69.3,B35,C,9, ,"Paris, France",1
3,0,2,"Augustsson, Mr. Albert",23,0,0,347468,7.8542, ,S, , ,"Krakoryd, Sweden Bloomington, IL",0
3,1,2,"Ayoub, Miss. Banoura",13,0,0,2687,7.2292, ,C,C, ,"Syria Youngstown, OH",1
3,0,2,"Baccos, Mr. Raffull",20,0,0,2679,7.225, ,C, , , ,0
3,0,2,"Backstrom, Mr. Karl Alfred",32,1,0,3101278,15.85, ,S,D, ,"Ruotsinphytaa, Finland New York, NY",0
3,1,2,"Backstrom, Mrs. Karl Alfred (Maria Mathilda Gustafsson)",33,3,0,3101278,15.85, ,S, , ,"Ruotsinphytaa, Finland New York, NY",1
3,1,2,"Baclini, Miss. Eugenie",.75,2,1,2666,19.2583, ,C,C, ,"Syria New York, NY",1
3,1,2,"Baclini, Miss. Helene Barbara",.75,2,1,2666,19.2583, ,C,C, ,"Syria New York, NY",1
3,1,2,"Baclini, Miss. Marie Catherine",5,2,1,2666,19.2583, ,C,C, ,"Syria New York, NY",1
3,1,2,"Baclini, Mrs. Solomon (Latifa Qurban)",24,0,3,2666,19.2583, ,C,C, ,"Syria New York, NY",1
3,1,1,"Badman, Miss. Emily Louisa",18,0,0,A/4 31416,8.05, ,S,C, ,"London Skanteales, NY",1
3,0,2,"Badt, Mr. Mohamed",40,0,0,2623,7.225, ,C, , , ,0
2,0,1,"Bailey, Mr. Percy Andrew",18,0,0,29108,11.5, ,S, , ,"Penzance, Cornwall / Akron, OH",0
2,0,2,"Baimbrigge, Mr. Charles Robert",23,0,0,C.A. 31030,10.5, ,S, , ,Guernsey,0
3,0,2,"Balkic, Mr. Cerin",26,0,0,349248,7.8958, ,S, , , ,0
2,1,1,"Ball, Mrs. (Ada E Hall)",36,0,0,28551,13,D,S,10, ,"Bristol, Avon / Jacksonville, FL",1
2,0,1,"Banfield, Mr. Frederick James",28,0,0,C.A./SOTON 34068,10.5, ,S, , ,"Plymouth, Dorset / Houghton, MI",0
3,1,2,"Barah, Mr. Hanna Assi",20,0,0,2663,7.2292, ,C,15, , ,0
3,0,2,"Barbara, Miss. Saiide",18,0,1,2691,14.4542, ,C, , ,"Syria Ottawa, ON",1
3,0,2,"Barbara, Mrs. (Catherine David)",45,0,1,2691,14.4542, ,C, , ,"Syria Ottawa, ON",1
1,1,2,"Barber, Miss. Ellen ""Nellie""",26,0,0,19877,78.85, ,S,6, , ,1
1,1,1,"Barkworth, Mr. Algernon Henry Wilson",80,0,0,27042,30,A23,S,B, ,"Hessle, Yorks",0
3,0,0,"Barry, Miss. Julia",27,0,0,330844,7.8792, ,Q, , ,"New York, NY",1
3,0,1,"Barton, Mr. David John",22,0,0,324669,8.05, ,S, , ,"England New York, NY",0
2,0,0,"Bateman, Rev. Robert James",51,0,0,S.O.P. 1166,12.525, ,S, ,174,"Jacksonville, FL",0
1,0,0,"Baumann, Mr. John D", ,0,0,PC 17318,25.925, ,S, , ,"New York, NY",0
1,0,2,"Baxter, Mr. Quigg Edmond",24,0,1,PC 17558,247.5208,B58 B60,C, , ,"Montreal, PQ",0
1,1,2,"Baxter, Mrs. James (Helene DeLaudeniere Chaput)",50,0,1,PC 17558,247.5208,B58 B60,C,6, ,"Montreal, PQ",1
1,1,2,"Bazzani, Miss. Albina",32,0,0,11813,76.2917,D15,C,8, , ,1
2,1,0,"Beane, Mr. Edward",32,1,0,2908,26, ,S,13, ,"Norwich / New York, NY",0
2,1,1,"Beane, Mrs. Edward (Ethel Clarke)",19,1,0,2908,26, ,S,13, ,"Norwich / New York, NY",1
1,0,2,"Beattie, Mr. Thomson",36,0,0,13050,75.2417,C6,C,A, ,"Winnipeg, MN",0
2,0,1,"Beauchamp, Mr. Henry James",28,0,0,244358,26, ,S, , ,England,0
3,0,1,"Beavan, Mr. William Thomas",19,0,0,323951,8.05, ,S, , ,England,0
2,1,2,"Becker, Master. Richard F",1,2,1,230136,39,F4,S,11, ,"Guntur, India / Benton Harbour, MI",0
2,1,2,"Becker, Miss. Marion Louise",4,2,1,230136,39,F4,S,11, ,"Guntur, India / Benton Harbour, MI",1
2,1,2,"Becker, Miss. Ruth Elizabeth",12,2,1,230136,39,F4,S,13, ,"Guntur, India / Benton Harbour, MI",1
2,1,2,"Becker, Mrs. Allen Oliver (Nellie E Baumgardner)",36,0,3,230136,39,F4,S,11, ,"Guntur, India / Benton Harbour, MI",1
1,1,0,"Beckwith, Mr. Richard Leonard",37,1,1,11751,52.5542,D35,S,5, ,"New York, NY",0
1,1,0,"Beckwith, Mrs. Richard Leonard (Sallie Monypeny)",47,1,1,11751,52.5542,D35,S,5, ,"New York, NY",1
2,1,1,"Beesley, Mr. Lawrence",34,0,0,248698,13,D56,S,13, ,London,0
1,1,0,"Behr, Mr. Karl Howell",26,0,0,111369,30,C148,C,5, ,"New York, NY",0
3,0,2,"Bengtsson, Mr. John Viktor",26,0,0,347068,7.775, ,S, , ,"Krakudden, Sweden Moune, IL",0
2,1,0,"Bentham, Miss. Lilian W",19,0,0,28404,13, ,S,12, ,"Rochester, NY",1
3,0,2,"Berglund, Mr. Karl Ivar Sven",22,0,0,PP 4348,9.35, ,S, , ,"Tranvik, Finland New York",0
2,0,1,"Berriman, Mr. William John",23,0,0,28425,13, ,S, , ,"St Ives, Cornwall / Calumet, MI",0
3,0,2,"Betros, Master. Seman", ,0,0,2622,7.2292, ,C, , , ,0
3,0,2,"Betros, Mr. Tannous",20,0,0,2648,4.0125, ,C, , ,Syria,0
1,1,2,"Bidois, Miss. Rosalie",42,0,0,PC 17757,227.525, ,C,4, , ,1
3,1,2,"Bing, Mr. Lee",32,0,0,1601,56.4958, ,S,C, ,"Hong Kong New York, NY",0
1,1,2,"Bird, Miss. Ellen",29,0,0,PC 17483,221.7792,C97,S,8, , ,1
3,0,2,"Birkeland, Mr. Hans Martin Monsen",21,0,0,312992,7.775, ,S, , ,"Brennes, Norway New York",0
1,0,2,"Birnbaum, Mr. Jakob",25,0,0,13905,26, ,C, ,148,"San Francisco, CA",0
1,1,0,"Bishop, Mr. Dickinson H",25,1,0,11967,91.0792,B49,C,7, ,"Dowagiac, MI",0
1,1,0,"Bishop, Mrs. Dickinson H (Helen Walton)",19,1,0,11967,91.0792,B49,C,7, ,"Dowagiac, MI",1
1,1,2,"Bissette, Miss. Amelia",35,0,0,PC 17760,135.6333,C99,S,8, , ,1
3,0,2,"Bjorklund, Mr. Ernst Herbert",18,0,0,347090,7.75, ,S, , ,"Stockholm, Sweden New York",0
1,1,2,"Bjornstrom-Steffansson, Mr. Mauritz Hakan",28,0,0,110564,26.55,C52,S,D, ,"Stockholm, Sweden / Washington, DC",0
1,0,0,"Blackwell, Mr. Stephen Weart",45,0,0,113784,35.5,T,S, , ,"Trenton, NJ",0
1,1,0,"Blank, Mr. Henry",40,0,0,112277,31,A31,C,7, ,"Glen Ridge, NJ",0
1,1,0,"Bonnell, Miss. Caroline",30,0,0,36928,164.8667,C7,S,8, ,"Youngstown, OH",1
1,1,1,"Bonnell, Miss. Elizabeth",58,0,0,113783,26.55,C103,S,8, ,"Birkdale, England Cleveland, Ohio",1
1,0,1,"Borebank, Mr. John James",42,0,0,110489,26.55,D22,S, , ,"London / Winnipeg, MB",0
3,0,2,"Bostandyeff, Mr. Guentcho",26,0,0,349224,7.8958, ,S, , ,"Bulgaria Chicago, IL",0
2,0,0,"Botsford, Mr. William Hull",26,0,0,237670,13, ,S, , ,"Elmira, NY / Orange, NJ",0
3,0,2,"Boulos, Master. Akar",6,1,1,2678,15.2458, ,C, , ,"Syria Kent, ON",0
3,0,2,"Boulos, Miss. Nourelain",9,1,1,2678,15.2458, ,C, , ,"Syria Kent, ON",1
3,0,2,"Boulos, Mr. Hanna", ,0,0,2664,7.225, ,C, , ,Syria,0
3,0,2,"Boulos, Mrs. Joseph (Sultana)", ,0,2,2678,15.2458, ,C, , ,"Syria Kent, ON",1
3,0,2,"Bourke, Miss. Mary", ,0,2,364848,7.75, ,Q, , ,"Ireland Chicago, IL",1
3,0,2,"Bourke, Mr. John",40,1,1,364849,15.5, ,Q, , ,"Ireland Chicago, IL",0
3,0,2,"Bourke, Mrs. John (Catherine)",32,1,1,364849,15.5, ,Q, , ,"Ireland Chicago, IL",1
1,1,0,"Bowen, Miss. Grace Scott",45,0,0,PC 17608,262.375, ,C,4, ,"Cooperstown, NY",1
3,0,2,"Bowen, Mr. David John ""Dai""",21,0,0,54636,16.1, ,S, , ,"Treherbert, Cardiff, Wales",0
2,0,2,"Bowenur, Mr. Solomon",42,0,0,211535,13, ,S, , ,London,0
1,1,1,"Bowerman, Miss. Elsie Edith",22,0,1,113505,55,E33,S,6, ,"St Leonards-on-Sea, England Ohio",1
2,0,0,"Bracken, Mr. James H",27,0,0,220367,13, ,S, , ,"Lake Arthur, Chavez County, NM",0
3,1,2,"Bradley, Miss. Bridget Delia",22,0,0,334914,7.725, ,Q,13, ,"Kingwilliamstown, Co Cork, Ireland Glens Falls, NY",1
1,1,2,"Bradley, Mr. George (""George Arthur Brayton"")", ,0,0,111427,26.55, ,S,9, ,"Los Angeles, CA",0
1,0,0,"Brady, Mr. John Bertram",41,0,0,113054,30.5,A21,S, , ,"Pomeroy, WA",0
3,0,2,"Braf, Miss. Elin Ester Maria",20,0,0,347471,7.8542, ,S, , ,"Medeltorp, Sweden Chicago, IL",1
1,0,0,"Brandeis, Mr. Emil",48,0,0,PC 17591,50.4958,B10,C, ,208,"Omaha, NE",0
3,0,1,"Braund, Mr. Lewis Richard",29,1,0,3460,7.0458, ,S, , ,"Bridgerule, Devon",0
3,0,1,"Braund, Mr. Owen Harris",22,1,0,A/5 21171,7.25, ,S, , ,"Bridgerule, Devon",0
1,0,0,"Brewe, Dr. Arthur Jackson", ,0,0,112379,39.6, ,C, , ,"Philadelphia, PA",0
3,0,2,"Brobeck, Mr. Karl Rudolf",22,0,0,350045,7.7958, ,S, , ,"Sweden Worcester, MA",0
3,0,1,"Brocklebank, Mr. William Alfred",35,0,0,364512,8.05, ,S, , ,"Broomfield, Chelmsford, England",0
2,1,1,"Brown, Miss. Amelia ""Mildred""",24,0,0,248733,13,F33,S,11, ,"London / Montreal, PQ",1
2,1,2,"Brown, Miss. Edith Eileen",15,0,2,29750,39, ,S,14, ,"Cape Town, South Africa / Seattle, WA",1
2,0,2,"Brown, Mr. Thomas William Solomon",60,1,1,29750,39, ,S, , ,"Cape Town, South Africa / Seattle, WA",0
1,1,2,"Brown, Mrs. James Joseph (Margaret Tobin)",44,0,0,PC 17610,27.7208,B4,C,6, ,"Denver, CO",1
1,1,2,"Brown, Mrs. John Murray (Caroline Lane Lamson)",59,2,0,11769,51.4792,C101,S,D, ,"Belmont, MA",1
2,1,2,"Brown, Mrs. Thomas William Solomon (Elizabeth Catherine Ford)",40,1,1,29750,39, ,S,14, ,"Cape Town, South Africa / Seattle, WA",1
2,1,2,"Bryhl, Miss. Dagmar Jenny Ingeborg",20,1,0,236853,26, ,S,12, ,"Skara, Sweden / Rockford, IL",1
2,0,2,"Bryhl, Mr. Kurt Arnold Gottfrid",25,1,0,236853,26, ,S, , ,"Skara, Sweden / Rockford, IL",0
3,0,2,"Buckley, Miss. Katherine",18.5,0,0,329944,7.2833, ,Q, ,299,"Co Cork, Ireland Roxbury, MA",1
3,1,2,"Buckley, Mr. Daniel",21,0,0,330920,7.8208, ,Q,13, ,"Kingwilliamstown, Co Cork, Ireland New York, NY",0
1,1,0,"Bucknell, Mrs. William Robert (Emma Eliza Ward)",60,0,0,11813,76.2917,D15,C,8, ,"Philadelphia, PA",1
3,0,2,"Burke, Mr. Jeremiah",19,0,0,365222,6.75, ,Q, , ,"Co Cork, Ireland Charlestown, MA",0
1,1,2,"Burns, Miss. Elizabeth Margaret",41,0,0,16966,134.5,E40,C,3, , ,1
3,0,2,"Burns, Miss. Mary Delia",18,0,0,330963,7.8792, ,Q, , ,"Co Sligo, Ireland New York, NY",1
2,1,1,"Buss, Miss. Kate",36,0,0,27849,13, ,S,9, ,"Sittingbourne, England / San Diego, CA",1
2,0,1,"Butler, Mr. Reginald Fenton",25,0,0,234686,13, ,S, ,97,"Southsea, Hants",0
1,0,0,"Butt, Major. Archibald Willingham",45,0,0,113050,26.55,B38,S, , ,"Washington, DC",0
2,0,1,"Byles, Rev. Thomas Roussel Davids",42,0,0,244310,13, ,S, , ,London,0
2,1,0,"Bystrom, Mrs. (Karolina)",42,0,0,236852,13, ,S, , ,"New York, NY",1
3,0,2,"Cacic, Miss. Manda",21,0,0,315087,8.6625, ,S, , , ,1
3,0,2,"Cacic, Miss. Marija",30,0,0,315084,8.6625, ,S, , , ,1
3,0,2,"Cacic, Mr. Jego Grga",18,0,0,315091,8.6625, ,S, , , ,0
3,0,2,"Cacic, Mr. Luka",38,0,0,315089,8.6625, ,S, , ,Croatia,0
1,0,2,"Cairns, Mr. Alexander", ,0,0,113798,31, ,S, , , ,0
1,1,0,"Calderhead, Mr. Edward Pennington",42,0,0,PC 17476,26.2875,E24,S,5, ,"New York, NY",0
2,1,2,"Caldwell, Master. Alden Gates",.8333,0,2,248738,29, ,S,13, ,"Bangkok, Thailand / Roseville, IL",0
2,1,2,"Caldwell, Mr. Albert Francis",26,1,1,248738,29, ,S,13, ,"Bangkok, Thailand / Roseville, IL",0
2,1,0,"Caldwell, Mrs. Albert Francis (Sylvia Mae Harbaugh)",22,1,1,248738,29, ,S,13, ,"Bangkok, Thailand / Roseville, IL",1
3,0,2,"Calic, Mr. Jovo",17,0,0,315093,8.6625, ,S, , , ,0
3,0,2,"Calic, Mr. Petar",17,0,0,315086,8.6625, ,S, , , ,0
2,1,1,"Cameron, Miss. Clear Annie",35,0,0,F.C.C. 13528,21, ,S,14, ,"Mamaroneck, NY",1
2,0,2,"Campbell, Mr. William", ,0,0,239853,0, ,S, , ,Belfast,0
3,0,2,"Canavan, Miss. Mary",21,0,0,364846,7.75, ,Q, , , ,1
3,0,2,"Canavan, Mr. Patrick",21,0,0,364858,7.75, ,Q, , ,"Ireland Philadelphia, PA",0
1,1,0,"Candee, Mrs. Edward (Helen Churchill Hungerford)",53,0,0,PC 17606,27.4458, ,C,6, ,"Washington, DC",1
3,0,1,"Cann, Mr. Ernest Charles",21,0,0,A./5. 2152,8.05, ,S, , , ,0
3,0,2,"Caram, Mr. Joseph", ,1,0,2689,14.4583, ,C, , ,"Ottawa, ON",0
3,0,2,"Caram, Mrs. Joseph (Maria Elias)", ,1,0,2689,14.4583, ,C, , ,"Ottawa, ON",1
2,0,1,"Carbines, Mr. William",19,0,0,28424,13, ,S, ,18,"St Ives, Cornwall / Calumet, MI",0
1,1,0,"Cardeza, Mr. Thomas Drake Martinez",36,0,1,PC 17755,512.3292,B51 B53 B55,C,3, ,"Austria-Hungary / Germantown, Philadelphia, PA",0
1,1,0,"Cardeza, Mrs. James Warburton Martinez (Charlotte Wardle Drake)",58,0,1,PC 17755,512.3292,B51 B53 B55,C,3, ,"Germantown, Philadelphia, PA",1
3,0,2,"Carlsson, Mr. August Sigfrid",28,0,0,350042,7.7958, ,S, , ,"Dagsas, Sweden Fower, MN",0
3,0,2,"Carlsson, Mr. Carl Robert",24,0,0,350409,7.8542, ,S, , ,"Goteborg, Sweden Huntley, IL",0
1,0,2,"Carlsson, Mr. Frans Olof",33,0,0,695,5,B51 B53 B55,S, , ,"New York, NY",0
3,1,2,"Carr, Miss. Helen ""Ellen""",16,0,0,367231,7.75, ,Q,16, ,"Co Longford, Ireland New York, NY",1
3,0,2,"Carr, Miss. Jeannie",37,0,0,368364,7.75, ,Q, , ,"Co Sligo, Ireland Hartford, CT",1
1,0,2,"Carrau, Mr. Francisco M",28,0,0,113059,47.1, ,S, , ,"Montevideo, Uruguay",0
1,0,2,"Carrau, Mr. Jose Pedro",17,0,0,113059,47.1, ,S, , ,"Montevideo, Uruguay",0
1,1,0,"Carter, Master. William Thornton II",11,1,2,113760,120,B96 B98,S,4, ,"Bryn Mawr, PA",0
1,1,0,"Carter, Miss. Lucile Polk",14,1,2,113760,120,B96 B98,S,4, ,"Bryn Mawr, PA",1
1,1,0,"Carter, Mr. William Ernest",36,1,2,113760,120,B96 B98,S,C, ,"Bryn Mawr, PA",0
2,0,1,"Carter, Mrs. Ernest Courtenay (Lilian Hughes)",44,1,0,244252,26, ,S, , ,London,1
1,1,0,"Carter, Mrs. William Ernest (Lucile Polk)",36,1,2,113760,120,B96 B98,S,4, ,"Bryn Mawr, PA",1
2,0,2,"Carter, Rev. Ernest Courtenay",54,1,0,244252,26, ,S, , ,London,0
3,0,1,"Carver, Mr. Alfred John",28,0,0,392095,7.25, ,S, , ,"St Denys, Southampton, Hants",0
1,0,1,"Case, Mr. Howard Brown",49,0,0,19924,26, ,S, , ,"Ascot, Berkshire / Rochester, NY",0
1,1,0,"Cassebeer, Mrs. Henry Arthur Jr (Eleanor Genevieve Fosdick)", ,0,0,17770,27.7208, ,C,5, ,"New York, NY",1
1,0,1,"Cavendish, Mr. Tyrell William",36,1,0,19877,78.85,C46,S, ,172,"Little Onn Hall, Staffs",0
1,1,1,"Cavendish, Mrs. Tyrell William (Julia Florence Siegel)",76,1,0,19877,78.85,C46,S,6, ,"Little Onn Hall, Staffs",1
3,0,2,"Celotti, Mr. Francesco",24,0,0,343275,8.05, ,S, , ,London,0
1,0,0,"Chaffee, Mr. Herbert Fuller",46,1,0,W.E.P. 5734,61.175,E31,S, , ,"Amenia, ND",0
1,1,0,"Chaffee, Mrs. Herbert Fuller (Carrie Constance Toogood)",47,1,0,W.E.P. 5734,61.175,E31,S,4, ,"Amenia, ND",1
1,1,0,"Chambers, Mr. Norman Campbell",27,1,0,113806,53.1,E8,S,5, ,"New York, NY / Ithaca, NY",0
1,1,0,"Chambers, Mrs. Norman Campbell (Bertha Griggs)",33,1,0,113806,53.1,E8,S,5, ,"New York, NY / Ithaca, NY",1
2,0,0,"Chapman, Mr. Charles Henry",52,0,0,248731,13.5, ,S, ,130,"Bronx, NY",0
2,0,1,"Chapman, Mr. John Henry",37,1,0,SC/AH 29037,26, ,S, ,17,"Cornwall / Spokane, WA",0
2,0,1,"Chapman, Mrs. John Henry (Sara Elizabeth Lawry)",29,1,0,SC/AH 29037,26, ,S, , ,"Cornwall / Spokane, WA",1
3,0,2,"Charters, Mr. David",21,0,0,A/5. 13032,7.7333, ,Q, , ,"Ireland New York, NY",0
1,1,2,"Chaudanson, Miss. Victorine",36,0,0,PC 17608,262.375,B61,C,4, , ,1
1,1,1,"Cherry, Miss. Gladys",30,0,0,110152,86.5,B77,S,8, ,"London, England",1
1,1,2,"Chevre, Mr. Paul Romaine",45,0,0,PC 17594,29.7,A9,C,7, ,"Paris, France",0
1,1,1,"Chibnall, Mrs. (Edith Martha Bowerman)", ,0,1,113505,55,E33,S,6, ,"St Leonards-on-Sea, England Ohio",1
3,1,2,"Chip, Mr. Chang",32,0,0,1601,56.4958, ,S,C, ,"Hong Kong New York, NY",0
1,0,2,"Chisholm, Mr. Roderick Robert Crispin", ,0,0,112051,0, ,S, , ,"Liverpool, England / Belfast",0
3,0,1,"Christmann, Mr. Emil",29,0,0,343276,8.05, ,S, , , ,0
2,1,1,"Christy, Miss. Julie Rachel",25,1,1,237789,30, ,S,12, ,London,1
2,1,1,"Christy, Mrs. (Alice Frances)",45,0,2,237789,30, ,S,12, ,London,1
3,0,2,"Chronopoulos, Mr. Apostolos",26,1,0,2680,14.4542, ,C, , ,Greece,0
3,0,2,"Chronopoulos, Mr. Demetrios",18,1,0,2680,14.4542, ,C, , ,Greece,0
1,0,0,"Clark, Mr. Walter Miller",27,1,0,13508,136.7792,C89,C, , ,"Los Angeles, CA",0
1,1,0,"Clark, Mrs. Walter Miller (Virginia McDowell)",26,1,0,13508,136.7792,C89,C,4, ,"Los Angeles, CA",1
2,0,1,"Clarke, Mr. Charles Valentine",29,1,0,2003,26, ,S, , ,"England / San Francisco, CA",0
2,1,1,"Clarke, Mrs. Charles V (Ada Maria Winfield)",28,1,0,2003,26, ,S,14, ,"England / San Francisco, CA",1
1,1,1,"Cleaver, Miss. Alice",22,0,0,113781,151.55, ,S,11, , ,1
1,0,0,"Clifford, Mr. George Quincy", ,0,0,110465,52,A14,S, , ,"Stoughton, MA",0
3,0,2,"Coelho, Mr. Domingos Fernandeo",20,0,0,SOTON/O.Q. 3101307,7.05, ,S, , ,Portugal,0
3,1,1,"Cohen, Mr. Gurshon ""Gus""",18,0,0,A/5 3540,8.05, ,S,12, ,"London Brooklyn, NY",0
3,0,2,"Colbert, Mr. Patrick",24,0,0,371109,7.25, ,Q, , ,"Co Limerick, Ireland Sherbrooke, PQ",0
3,0,2,"Coleff, Mr. Peju",36,0,0,349210,7.4958, ,S, , ,"Bulgaria Chicago, IL",0
3,0,2,"Coleff, Mr. Satio",24,0,0,349209,7.4958, ,S, , , ,0
2,0,1,"Coleridge, Mr. Reginald Charles",29,0,0,W./C. 14263,10.5, ,S, , ,"Hartford, Huntingdonshire",0
2,0,2,"Collander, Mr. Erik Gustaf",28,0,0,248740,13, ,S, , ,"Helsinki, Finland Ashtabula, Ohio",0
2,1,1,"Collett, Mr. Sidney C Stuart",24,0,0,28034,10.5, ,S,9, ,"London / Fort Byron, NY",0
1,0,2,"Colley, Mr. Edward Pomeroy",47,0,0,5727,25.5875,E58,S, , ,"Victoria, BC",0
2,1,1,"Collyer, Miss. Marjorie ""Lottie""",8,0,2,C.A. 31921,26.25, ,S,14, ,"Bishopstoke, Hants / Fayette Valley, ID",1
2,0,1,"Collyer, Mr. Harvey",31,1,1,C.A. 31921,26.25, ,S, , ,"Bishopstoke, Hants / Fayette Valley, ID",0
2,1,1,"Collyer, Mrs. Harvey (Charlotte Annie Tate)",31,1,1,C.A. 31921,26.25, ,S,14, ,"Bishopstoke, Hants / Fayette Valley, ID",1
1,1,0,"Compton, Miss. Sara Rebecca",39,1,1,PC 17756,83.1583,E49,C,14, ,"Lakewood, NJ",1
1,0,0,"Compton, Mr. Alexander Taylor Jr",37,1,1,PC 17756,83.1583,E52,C, , ,"Lakewood, NJ",0
1,1,0,"Compton, Mrs. Alexander Taylor (Mary Eliza Ingersoll)",64,0,2,PC 17756,83.1583,E45,C,14, ,"Lakewood, NJ",1
3,0,0,"Conlon, Mr. Thomas Henry",31,0,0,21332,7.7333, ,Q, , ,"Philadelphia, PA",0
3,0,2,"Connaghton, Mr. Michael",31,0,0,335097,7.75, ,Q, , ,"Ireland Brooklyn, NY",0
3,1,2,"Connolly, Miss. Kate",22,0,0,370373,7.75, ,Q,13, ,Ireland,1
3,0,2,"Connolly, Miss. Kate",30,0,0,330972,7.6292, ,Q, , ,Ireland,1
3,0,2,"Connors, Mr. Patrick",70.5,0,0,370369,7.75, ,Q, ,171, ,0
3,0,2,"Cook, Mr. Jacob",43,0,0,A/5 3536,8.05, ,S, , , ,0
2,1,2,"Cook, Mrs. (Selena Rogers)",22,0,0,W./C. 14266,10.5,F33,S,14, ,Pennsylvania,1
3,0,2,"Cor, Mr. Bartol",35,0,0,349230,7.8958, ,S, , ,Austria,0
3,0,2,"Cor, Mr. Ivan",27,0,0,349229,7.8958, ,S, , ,Austria,0
3,0,2,"Cor, Mr. Liudevit",19,0,0,349231,7.8958, ,S, , ,Austria,0
2,0,0,"Corbett, Mrs. Walter H (Irene Colvin)",30,0,0,237249,13, ,S, , ,"Provo, UT",1
2,0,2,"Corey, Mrs. Percy C (Mary Phyllis Elizabeth Miller)", ,0,0,F.C.C. 13534,21, ,S, , ,"Upper Burma, India Pittsburgh, PA",1
3,0,1,"Corn, Mr. Harry",30,0,0,SOTON/OQ 392090,8.05, ,S, , ,London,0
1,1,0,"Cornell, Mrs. Robert Clifford (Malvina Helen Lamson)",55,2,0,11770,25.7,C101,S,2, ,"New York, NY",1
2,0,1,"Cotterill, Mr. Henry ""Harry""",21,0,0,29107,11.5, ,S, , ,"Penzance, Cornwall / Akron, OH",0
3,1,1,"Coutts, Master. Eden Leslie ""Neville""",9,1,1,C.A. 37671,15.9, ,S,2, ,"England Brooklyn, NY",0
3,1,1,"Coutts, Master. William Loch ""William""",3,1,1,C.A. 37671,15.9, ,S,2, ,"England Brooklyn, NY",0
3,1,1,"Coutts, Mrs. William (Winnie ""Minnie"" Treanor)",36,0,2,C.A. 37671,15.9, ,S,2, ,"England Brooklyn, NY",1
3,0,1,"Coxon, Mr. Daniel",59,0,0,364500,7.25, ,S, , ,"Merrill, WI",0
1,0,0,"Crafton, Mr. John Bertram", ,0,0,113791,26.55, ,S, , ,"Roachdale, IN",0
3,0,1,"Crease, Mr. Ernest James",19,0,0,S.P. 3464,8.1583, ,S, , ,"Bristol, England Cleveland, OH",0
3,1,1,"Cribb, Miss. Laura Alice",17,0,1,371362,16.1, ,S,12, ,"Bournemouth, England Newark, NJ",1
3,0,1,"Cribb, Mr. John Hatfield",44,0,1,371362,16.1, ,S, , ,"Bournemouth, England Newark, NJ",0
1,0,0,"Crosby, Capt. Edward Gifford",70,1,1,WE/P 5735,71,B22,S, ,269,"Milwaukee, WI",0
1,1,2,"Crosby, Miss. Harriet R",36,0,2,WE/P 5735,71,B22,S,7, ,"Milwaukee, WI",1
1,1,0,"Crosby, Mrs. Edward Gifford (Catherine Elizabeth Halstead)",64,1,1,112901,26.55,B26,S,7, ,"Milwaukee, WI",1
3,0,2,"Culumovic, Mr. Jeso",17,0,0,315090,8.6625, ,S, , ,Austria-Hungary,0
1,0,0,"Cumings, Mr. John Bradley",39,1,0,PC 17599,71.2833,C85,C, , ,"New York, NY",0
